{
  "id": "russian.9.lesson-013",
  "version": "1.0.0",
  "subject": "russian",
  "grade": 9,
  "lesson": 13,
  "title": "Сжатое изложение. Пушкин и Пущин",
  "mode": "practice",
  "estimatedMinutes": 40,
  "pacing": "Домашняя работа в своём темпе. Можно делать паузы и возвращаться к сохранённым ответам. Дополнительные задания — по желанию.",
  "stages": [
    {
      "id": "meaning",
      "title": "Микротемы"
    },
    {
      "id": "techniques",
      "title": "Приёмы"
    },
    {
      "id": "writing",
      "title": "Пишем"
    },
    {
      "id": "revision",
      "title": "Редактура"
    },
    {
      "id": "reserve",
      "title": "Резерв"
    }
  ],
  "material": {
    "paragraphs": [
      "Необычной была дружба этих двух людей: Александра Сергеевича Пушкина и Ивана Ивановича Пущина. Шесть лет они учились вместе в Царскосельском лицее. Затем были довольно редкие встречи в Петербурге у общих знакомых. И вот единственный день, проведённый вместе, 11 января 1825 года, когда Пущин первым из друзей посетил Пушкина, который находился в ссылке в Михайловском. И всё. Больше они никогда не виделись. 11 лет Пущин-декабрист провёл в тюрьме и на каторге. Но дружба не слабела: многие стихотворения Пушкин посвятил другу.",
      "После смерти Пушкина настал черёд Пущина одного за двоих хранить верность старой дружбе. Он словно и не считал Пушкина погибшим, непрестанно обращался к лицейским годам, к Михайловскому свиданию, добывал неизвестные ему прежде стихи Пушкина, письма, прозу и как бы во второй раз узнавал лицейского товарища.",
      "Влияние личности и образа мысли Пущина на Пушкина, начавшееся ещё в лицее, очень значительно. Большой Жанно – так называли лицеисты Пущина – не раз охлаждал горячую голову темпераментного друга, никогда с отроческих лет не боялся сказать другу правду. Столь же, несомненно, и велико влияние Пушкина на Пущина. Огромный талант, глубокий ум, острота чувств, доброе сердце – всё это могло оставить равнодушной личность мелкую, но такого человека, как Пущин, покорило навсегда."
    ],
    "samples": [
      "Пушкин и Пущин подружились в Царскосельском лицее. Позже они встречались редко, а после свидания в Михайловском больше не виделись, но дружба оставалась крепкой. Пушкин посвятил другу многие стихотворения.",
      "После смерти Пушкина Пущин остался верен лицейской дружбе. Воспоминания о встречах и знакомство с творческим наследием Пушкина помогали ему заново узнавать Пушкина.",
      "Пущин с юности сдерживал вспыльчивость Пушкина и не боялся говорить ему правду. Пушкин же навсегда покорил друга талантом, умом и душевными качествами."
    ],
    "attribution": "По В. В. Кунину. Текст из рабочего листа урока 13; обозначение AFA040 приведено по материалам урока.",
    "sourceUrl": "https://docs.google.com/document/d/1RwwZD-cPfPV4cW6pvUwMljbpDyeFBrzw/edit"
  },
  "writingTaskIds": [
    "paragraph-1",
    "paragraph-2",
    "paragraph-3"
  ],
  "finalTaskId": "final-text",
  "manualGroups": [
    {
      "id": "independent-text",
      "title": "Самостоятельные абзацы 2–3",
      "task_ids": [
        "paragraph-2",
        "paragraph-3",
        "links",
        "methods"
      ],
      "criteria": [
        {
          "id": "c1",
          "text": "Сохранена верность Пущина после смерти друга.",
          "points": 1
        },
        {
          "id": "c2",
          "text": "Показано новое узнавание Пушкина через память и творчество.",
          "points": 1
        },
        {
          "id": "c3",
          "text": "Сохранены оба проявления влияния Пущина: сдерживал вспыльчивость и говорил правду.",
          "points": 1
        },
        {
          "id": "c4",
          "text": "Показано влияние таланта и личных качеств Пушкина на Пущина.",
          "points": 1
        },
        {
          "id": "c5",
          "text": "Оба абзаца сокращены без искажений и добавлений.",
          "points": 1
        },
        {
          "id": "c6",
          "text": "Мысли связаны; верно назван и показан хотя бы один приём сжатия.",
          "points": 1
        }
      ],
      "scale": "Учебная диагностика; не шкала ОГЭ. Не складывать с автобаллами подготовки."
    }
  ],
  "checklist": [
    "Все три микротемы сохранены.",
    "Не изменён порядок смысловых частей.",
    "После смерти Пушкина Пущин остаётся верен другу.",
    "Показано влияние каждого из друзей на другого.",
    "Нет добавленных фактов и смысловых искажений.",
    "Предложения связаны, повторы и неточные местоимения исправлены."
  ],
  "tasks": [
    {
      "id": "micro-1",
      "type": "single-choice",
      "stage": "meaning",
      "prompt": "Что главное в абзаце 1?",
      "skill": "summary.microtheme",
      "points": 1,
      "paragraph": 1,
      "options": [
        {
          "id": "0",
          "text": "Обучение в лицее"
        },
        {
          "id": "1",
          "text": "Дружба, сохранившаяся вопреки разлуке"
        },
        {
          "id": "2",
          "text": "Жизнь Пушкина в Михайловском"
        }
      ],
      "answer": "1",
      "explanation": "Лицей и встречи — обстоятельства. Главное: разлука не ослабила дружбу; Пушкин посвящал другу стихотворения.",
      "hint": "Выбирай формулировку, которая охватывает весь абзац, а не отдельную подробность.",
      "errorTags": [
        "microtheme-too-narrow"
      ]
    },
    {
      "id": "micro-2",
      "type": "single-choice",
      "stage": "meaning",
      "prompt": "Что главное в абзаце 2?",
      "skill": "summary.microtheme",
      "points": 1,
      "paragraph": 2,
      "options": [
        {
          "id": "0",
          "text": "Верность Пущина после смерти друга и новое узнавание Пушкина"
        },
        {
          "id": "1",
          "text": "Сбор стихотворений Пушкина"
        },
        {
          "id": "2",
          "text": "Лицейские воспоминания"
        }
      ],
      "answer": "0",
      "explanation": "Важно сохранить и верность после смерти друга, и новое узнавание Пушкина через воспоминания и произведения.",
      "hint": "Выбирай формулировку, которая охватывает весь абзац, а не отдельную подробность.",
      "errorTags": [
        "microtheme-too-narrow"
      ]
    },
    {
      "id": "micro-3",
      "type": "single-choice",
      "stage": "meaning",
      "prompt": "Что главное в абзаце 3?",
      "skill": "summary.microtheme",
      "points": 1,
      "paragraph": 3,
      "options": [
        {
          "id": "0",
          "text": "Влияние Пущина на Пушкина"
        },
        {
          "id": "1",
          "text": "Талант Пушкина"
        },
        {
          "id": "2",
          "text": "Взаимное влияние друзей"
        }
      ],
      "answer": "2",
      "explanation": "В абзаце два направления влияния. Заголовок должен охватывать вклад каждого из друзей.",
      "hint": "Выбирай формулировку, которая охватывает весь абзац, а не отдельную подробность.",
      "errorTags": [
        "microtheme-too-narrow"
      ]
    },
    {
      "id": "own-plan",
      "type": "open-response",
      "stage": "meaning",
      "prompt": "Составь свой план из трёх пунктов",
      "skill": "summary.plan",
      "points": 0,
      "context": "Перечитай текст ниже и составь три пункта плана: один пункт — одна микротема. Формулируй своими словами. В третьем пункте отрази вклад каждого из друзей.",
      "placeholder": "1. …\n2. …\n3. …",
      "rubric": [
        "Сохранены все три микротемы и их порядок.",
        "Пункт плана охватывает смысл всего абзаца.",
        "Третий пункт отражает взаимное влияние."
      ],
      "showFullText": true,
      "referenceTitle": "Текст для составления плана"
    },
    {
      "id": "technique-1",
      "type": "single-choice",
      "stage": "techniques",
      "prompt": "Как сокращён этот фрагмент?",
      "skill": "summary.compression",
      "points": 1,
      "context": "Пример 1 из 9. Сравни исходный фрагмент и результат.",
      "sourceParagraph": 1,
      "before": "Необычной была дружба этих двух людей: Александра Сергеевича Пушкина и Ивана Ивановича Пущина.",
      "after": "Необычной была дружба Пушкина и Пущина.",
      "options": [
        {
          "id": "0",
          "text": "Исключение"
        },
        {
          "id": "1",
          "text": "Обобщение"
        },
        {
          "id": "2",
          "text": "Упрощение"
        }
      ],
      "answer": "0",
      "explanation": "Исключены имена, отчества и уточнение «этих двух людей». Сообщение о необычной дружбе сохранено.",
      "hint": "Исключение: убираем второстепенное. Обобщение: заменяем перечисление общим понятием. Упрощение: перестраиваем синтаксическую конструкцию.",
      "errorTags": [
        "compression-method"
      ]
    },
    {
      "id": "technique-2",
      "type": "single-choice",
      "stage": "techniques",
      "prompt": "Как сокращён этот фрагмент?",
      "skill": "summary.compression",
      "points": 1,
      "context": "Пример 2 из 9. Сравни исходный фрагмент и результат.",
      "sourceParagraph": 2,
      "before": "неизвестные ему прежде стихи Пушкина, письма, прозу",
      "after": "неизвестное ему прежде наследие Пушкина",
      "options": [
        {
          "id": "0",
          "text": "Исключение"
        },
        {
          "id": "1",
          "text": "Обобщение"
        },
        {
          "id": "2",
          "text": "Упрощение"
        }
      ],
      "answer": "1",
      "explanation": "Стихи, письма и проза объединены понятием «наследие». Сохранено указание на то, что эти материалы прежде были Пущину неизвестны.",
      "hint": "Исключение: убираем второстепенное. Обобщение: заменяем перечисление общим понятием. Упрощение: перестраиваем синтаксическую конструкцию.",
      "errorTags": [
        "compression-method"
      ]
    },
    {
      "id": "technique-3",
      "type": "single-choice",
      "stage": "techniques",
      "prompt": "Как сокращён этот фрагмент?",
      "skill": "summary.compression",